{
  "$ref": "#/definitions/AppConfig",
  "$schema": "http://json-schema.org/draft-07/schema#",
  "definitions": {
    "AppConfig": {
      "additionalProperties": false,
      "description": "config.json schema",
      "properties": {
        "apt": {
          "description": "List of apt packages to install (mode=rpios)",
          "items": {
            "type": "string"
          },
          "type": "array"
        },
        "cache": {
          "$ref": "#/definitions/CacheConfig",
          "description": "Default cache settings"
        },
        "category": {
          "description": "Category for this app",
          "type": "string"
        },
        "description": {
          "description": "Description for this app",
          "type": "string"
        },
        "fields": {
          "description": "Fields for app in diagram editor",
          "items": {
            "anyOf": [
              {
                "$ref": "#/definitions/AppConfigField"
              },
              {
                "$ref": "#/definitions/MarkdownField"
              }
            ]
          },
          "type": "array"
        },
        "name": {
          "description": "Name for this app",
          "type": "string"
        },
        "origin": {
          "description": "Origin app this app was created from, such as repo/apps/text/jsText",
          "type": "string"
        },
        "output": {
          "description": "Returned fields",
          "items": {
            "$ref": "#/definitions/OutputField"
          },
          "type": "array"
        },
        "permissions": {
          "description": "What the app may do on the frame (utils/sceneAccess.ts): \"shell\", \"files\" (read any file), \"assets\" (read the assets folder), \"assets-write\" (write it). Filled from a JS app's code on every save; the frame gives the app exactly this list (FrameOS 2026.10.16+).",
          "items": {
            "enum": ["shell", "files", "assets", "assets-write"],
            "type": "string"
          },
          "type": "array"
        },
        "permissionsAuto": {
          "description": "false: `permissions` is set by hand and saving leaves it as written.",
          "type": "boolean"
        },
        "settings": {
          "description": "List of top level settings exported for this app",
          "items": {
            "type": "string"
          },
          "type": "array"
        },
        "version": {
          "description": "Version for this app",
          "type": "string"
        }
      },
      "required": ["name"],
      "type": "object"
    },
    "AppConfigField": {
      "additionalProperties": false,
      "properties": {
        "capabilities": {
          "$ref": "#/definitions/InputPortCapabilities",
          "description": "Runtime-only: what this input port can negotiate. Never shown in the editor."
        },
        "extensions": {
          "description": "Allowed file extensions without the dot (e.g. [\"jpg\", \"png\"]), only used if type is 'path'",
          "items": {
            "type": "string"
          },
          "type": "array"
        },
        "filter": {
          "const": "more",
          "description": "Event payload fields only (frontend/schema/events.json, from the contract's `filter: \"more\"`): the event node keeps this filter folded until one is set.",
          "type": "string"
        },
        "hint": {
          "description": "Info tooltip contents (markdown)",
          "type": "string"
        },
        "label": {
          "description": "Human readable label",
          "type": "string"
        },
        "name": {
          "description": "Unique config field keyword",
          "type": "string"
        },
        "options": {
          "description": "List of options for the field, only used if type is 'select'",
          "items": {
            "$ref": "#/definitions/SelectFieldOption"
          },
          "type": "array"
        },
        "pick": {
          "$ref": "#/definitions/PathFieldPick",
          "description": "Whether the path points at a file, a folder or either, only used if type is 'path'"
        },
        "placeholder": {
          "description": "Placeholder text for the field",
          "type": "string"
        },
        "required": {
          "description": "Whether the field is required",
          "type": "boolean"
        },
        "rows": {
          "description": "Number of rows for the field, only used if type is 'text'",
          "type": "number"
        },
        "secret": {
          "description": "Whether the field is a secret and is hidden from display",
          "type": "boolean"
        },
        "seq": {
          "description": "Turn the field into a multidimensional array of fields. seq=[1, \"rows\"] --> for 1 to rows",
          "items": {
            "items": [
              {
                "type": "string"
              },
              {
                "type": ["number", "string"]
              },
              {
                "type": ["number", "string"]
              }
            ],
            "maxItems": 3,
            "minItems": 3,
            "type": "array"
          },
          "type": "array"
        },
        "showIf": {
          "description": "Conditions on which to show the field",
          "items": {
            "anyOf": [
              {
                "$ref": "#/definitions/ConfigFieldCondition"
              },
              {
                "$ref": "#/definitions/ConfigFieldConditionAnd"
              }
            ]
          },
          "type": "array"
        },
        "type": {
          "$ref": "#/definitions/AppConfigFieldType",
          "description": "Type of the field"
        },
        "value": {
          "description": "Default value for the field"
        }
      },
      "required": ["name", "label", "type"],
      "type": "object"
    },
    "AppConfigFieldType": {
      "anyOf": [
        {
          "$ref": "#/definitions/FieldType"
        },
        {
          "const": "select",
          "type": "string"
        },
        {
          "const": "font",
          "type": "string"
        }
      ]
    },
    "CacheConfig": {
      "additionalProperties": false,
      "properties": {
        "duration": {
          "type": "string"
        },
        "durationEnabled": {
          "type": "boolean"
        },
        "enabled": {
          "type": "boolean"
        },
        "expression": {
          "type": "string"
        },
        "expressionEnabled": {
          "type": "boolean"
        },
        "expressionType": {
          "$ref": "#/definitions/FieldType"
        },
        "inputEnabled": {
          "type": "boolean"
        }
      },
      "type": "object"
    },
    "ConfigFieldCondition": {
      "additionalProperties": false,
      "properties": {
        "field": {
          "type": "string"
        },
        "operator": {
          "$ref": "#/definitions/ConfigFieldConditionOperator"
        },
        "value": {}
      },
      "required": ["field"],
      "type": "object"
    },
    "ConfigFieldConditionAnd": {
      "additionalProperties": false,
      "properties": {
        "and": {
          "items": {
            "$ref": "#/definitions/ConfigFieldCondition"
          },
          "type": "array"
        }
      },
      "required": ["and"],
      "type": "object"
    },
    "ConfigFieldConditionOperator": {
      "enum": ["eq", "ne", "gt", "lt", "gte", "lte", "empty", "notEmpty", "in", "notIn"],
      "type": "string"
    },
    "FieldType": {
      "enum": [
        "string",
        "text",
        "float",
        "integer",
        "boolean",
        "color",
        "date",
        "json",
        "node",
        "scene",
        "image",
        "font",
        "path"
      ],
      "type": "string"
    },
    "ForwardsBoundsCapability": {
      "additionalProperties": false,
      "properties": {
        "heightFrom": {
          "type": "string"
        },
        "input": {
          "description": "Input port the consumer's useful-resolution bounds are passed on to",
          "type": "string"
        },
        "swapWhen": {
          "additionalProperties": false,
          "description": "Field controlling the geometry (a rotation degree): values in `swap` exchange width and height, values in `keep` pass them through, anything else refuses the bounds plan.",
          "properties": {
            "field": {
              "type": "string"
            },
            "keep": {
              "items": {
                "type": "string"
              },
              "type": "array"
            },
            "swap": {
              "items": {
                "type": "string"
              },
              "type": "array"
            }
          },
          "required": ["field", "swap", "keep"],
          "type": "object"
        },
        "widthFrom": {
          "description": "Or replace the bounds with these fields' static values (a resize)",
          "type": "string"
        }
      },
      "required": ["input"],
      "type": "object"
    },
    "ForwardsTargetCapability": {
      "additionalProperties": false,
      "properties": {
        "input": {
          "description": "Input port the target request is passed on to",
          "type": "string"
        },
        "requireStatic": {
          "additionalProperties": {
            "items": {
              "type": "string"
            },
            "type": "array"
          },
          "type": "object"
        }
      },
      "required": ["input"],
      "type": "object"
    },
    "InputPortCapabilities": {
      "additionalProperties": false,
      "properties": {
        "providesTarget": {
          "$ref": "#/definitions/ProvidesTargetCapability",
          "description": "This input can hand its producer an image to write into"
        }
      },
      "type": "object"
    },
    "IntoTargetCapability": {
      "additionalProperties": false,
      "properties": {
        "fits": {
          "items": {
            "type": "string"
          },
          "type": "array"
        },
        "requireOpaqueColor": {
          "description": "Color fields that must statically resolve to a fully opaque color for the capability to apply — the \"output is opaque given these fields\" promise that lets a generator (gradient, solid color) fill the target in place.",
          "items": {
            "type": "string"
          },
          "type": "array"
        },
        "requireStatic": {
          "additionalProperties": {
            "items": {
              "type": "string"
            },
            "type": "array"
          },
          "type": "object"
        },
        "requireUnset": {
          "items": {
            "type": "string"
          },
          "type": "array"
        }
      },
      "type": "object"
    },
    "MarkdownField": {
      "additionalProperties": false,
      "properties": {
        "markdown": {
          "description": "Block of markdown text to display between fields",
          "type": "string"
        },
        "showIf": {
          "description": "Conditions on which to show the field",
          "items": {
            "$ref": "#/definitions/ConfigFieldCondition"
          },
          "type": "array"
        }
      },
      "required": ["markdown"],
      "type": "object"
    },
    "OutputField": {
      "additionalProperties": false,
      "properties": {
        "capabilities": {
          "$ref": "#/definitions/OutputPortCapabilities",
          "description": "Runtime-only: what this output port can negotiate. Never shown in the editor."
        },
        "example": {
          "description": "Example output (stringified)",
          "type": "string"
        },
        "name": {
          "description": "Name of the output field",
          "type": "string"
        },
        "type": {
          "$ref": "#/definitions/FieldType",
          "description": "Type of the field"
        }
      },
      "required": ["name", "type"],
      "type": "object"
    },
    "OutputPortCapabilities": {
      "additionalProperties": false,
      "properties": {
        "forwardsBounds": {
          "$ref": "#/definitions/ForwardsBoundsCapability",
          "description": "This output passes useful-resolution bounds upstream (requestedBounds)"
        },
        "forwardsTarget": {
          "$ref": "#/definitions/ForwardsTargetCapability",
          "description": "This output passes a target request upstream and mutates the result in place"
        },
        "intoTarget": {
          "$ref": "#/definitions/IntoTargetCapability",
          "description": "This output writes into a caller-supplied image instead of allocating one"
        }
      },
      "type": "object"
    },
    "PathFieldPick": {
      "description": "What a 'path' field may point at. Defaults to 'file' when absent.",
      "enum": ["file", "folder", "any"],
      "type": "string"
    },
    "ProvidesTargetCapability": {
      "additionalProperties": false,
      "description": "Execution protocols a port declares, read by the frame's planner (frameos/planner.nim) and never by the editor — see docs/value-pipeline.md. Absent means \"materialized\", the floor every edge supports.",
      "properties": {
        "compositingRequireStatic": {
          "additionalProperties": {
            "items": {
              "type": "string"
            },
            "type": "array"
          },
          "description": "Extra requireStatic constraints applied when the producer composites into the target (a JS app drawing source-over) instead of overwriting every fitted pixel",
          "type": "object"
        },
        "fitFrom": {
          "description": "Config field carrying the fit (cover/contain/stretch) to ask the producer for",
          "type": "string"
        },
        "fits": {
          "description": "Fits this port can hand upstream",
          "items": {
            "type": "string"
          },
          "type": "array"
        },
        "ownedTargetExcludes": {
          "description": "Field/value combinations where an app-owned scratch target changes the pixels",
          "items": {
            "additionalProperties": {
              "type": "string"
            },
            "type": "object"
          },
          "type": "array"
        },
        "requireStatic": {
          "additionalProperties": {
            "items": {
              "type": "string"
            },
            "type": "array"
          },
          "description": "Field -> values it must statically resolve to for the capability to apply",
          "type": "object"
        },
        "requireUnset": {
          "description": "Fields that must be neither configured nor wired",
          "items": {
            "type": "string"
          },
          "type": "array"
        }
      },
      "type": "object"
    },
    "SelectFieldOption": {
      "anyOf": [
        {
          "type": "string"
        },
        {
          "additionalProperties": false,
          "properties": {
            "label": {
              "type": "string"
            },
            "value": {
              "type": "string"
            }
          },
          "required": ["value", "label"],
          "type": "object"
        }
      ],
      "description": "One choice of a 'select' field: a plain string (the value doubles as the label), or an explicit pair when the stored value and the text shown differ."
    }
  }
}
