{
  "name": "Photo album",
  "description": "Play an album from FrameOS Photos through its share link, one photo per render, or show one photo of it.",
  "category": "data",
  "version": "1.0.0",
  "fields": [
    {
      "name": "album",
      "type": "string",
      "value": "",
      "required": true,
      "label": "Album link",
      "hint": "Make one with Install photo scenes on the Photos page.",
      "placeholder": "https://example.com/api/photos/shared/pk_..."
    },
    {
      "name": "photo",
      "type": "string",
      "value": "",
      "required": false,
      "label": "One photo",
      "hint": "The path of one photo inside the album, to show it alone. Leave empty to play the album."
    },
    {
      "name": "order",
      "type": "select",
      "value": "random",
      "options": [
        "random",
        "sequential",
        "newest",
        "oldest"
      ],
      "required": false,
      "label": "Order",
      "hint": "random shows every photo once before any repeats. sequential goes by folder and file name, newest and oldest by date."
    },
    {
      "name": "landscape",
      "type": "boolean",
      "value": true,
      "required": false,
      "label": "Landscape photos",
      "hint": "Play photos that are wider than tall."
    },
    {
      "name": "portrait",
      "type": "boolean",
      "value": true,
      "required": false,
      "label": "Portrait photos",
      "hint": "Play photos that are taller than wide."
    },
    {
      "name": "square",
      "type": "boolean",
      "value": true,
      "required": false,
      "label": "Square photos",
      "hint": "Play photos that are exactly as wide as tall."
    },
    {
      "name": "counterStateKey",
      "type": "string",
      "value": "photoIndex",
      "required": false,
      "label": "State field for the position",
      "hint": "The scene needs an integer state field with this name, saved to disk, so the album keeps its place after a restart or a deep sleep. Leave empty to pick a random photo each time."
    }
  ],
  "output": [
    {
      "name": "image",
      "type": "image"
    }
  ],
  "cache": {
    "enabled": false
  }
}
