{
  "name": "iCal to State",
  "description": "Read iCal URLs",
  "category": "utils",
  "version": "1.0.0",
  "fields": [
    {
      "name": "url",
      "type": "string",
      "value": "https://calendar.google.com/calendar/ical/0hfd6vcbncn6p5hn1t4d2b2k4s%40group.calendar.google.com/public/basic.ics",
      "required": true,
      "label": "Calendar URL",
      "placeholder": ""
    },
    {
      "name": "stateKey",
      "type": "string",
      "value": "reply",
      "required": true,
      "label": "State key for reply"
    },
    {
      "name": "cacheSeconds",
      "type": "float",
      "value": "60",
      "required": false,
      "label": "Seconds to cache the response for",
      "placeholder": "Default: 60. Use 0 for no cache"
    }
  ]
}
