{
    "name": "Chromium screenshot",
    "description": "Capture a snapshot of a website with playwright and headless chromium. Needs a 64-bit system and at least 1GB of RAM.",
    "category": "data",
    "version": "1.0.0",
    "permissions": ["shell"],
    "fields": [
      {
        "name": "url",
        "type": "text",
        "value": "https://frameos.net/",
        "required": true,
        "label": "URL to capture",
        "placeholder": ""
      },
      {
        "name": "width",
        "type": "integer",
        "value": "",
        "label": "Width (0=full width)",
        "placeholder": "0"
      },
      {
        "name": "height",
        "type": "integer",
        "value": "",
        "label": "Height (0=full height)",
        "placeholder": "0"
      },
      {
        "name": "persistSession",
        "type": "boolean",
        "value": true,
        "label": "Persist browser session between renders",
        "hint": "When enabled, cookies/session storage persist between captures. Disable to use a fresh incognito-like session for each render."
      },
      {
        "name": "disableLowMemoryCheck",
        "type": "boolean",
        "value": false,
        "label": "Disable low memory check",
        "hint": "Always install and run Chromium, even if we have less than 1GB of RAM. Disable this at your own risk!"
      }
    ],
    "output": [
      {
        "name": "image",
        "type": "image"
      }
    ],
    "cache": {
      "enabled": true,
      "inputEnabled": true,
      "durationEnabled": true,
      "duration": "900"
    }
  }
