{
  "name": "Download Image",
  "description": "Download image from an URL",
  "category": "data",
  "version": "1.0.0",
  "fields": [
    {
      "name": "url",
      "type": "text",
      "value": "",
      "required": true,
      "label": "Image URL",
      "placeholder": "https://domain/image"
    },
    {
      "name": "metadataStateKey",
      "type": "string",
      "value": "",
      "required": false,
      "label": "Optional metadata state key",
      "hint": "Enter a state key to persist metadata about the image. Stores: {url, width, height, exif: {make, model, lensModel, exposureTime, fNumber, iso, focalLength, dateTimeOriginal, gpsLatitude, ...}, exifSummary}. EXIF is parsed from JPEG downloads; exifSummary is a one-line photographer credit."
    }
  ],
  "output": [
    {
      "name": "image",
      "type": "image",
      "capabilities": { "intoTarget": {} }
    }
  ],
  "cache": {
    "enabled": true,
    "inputEnabled": true,
    "durationEnabled": true,
    "duration": "900"
  }
}
