{
    "name": "If",
    "description": "If-Then-Else",
    "category": "util",
    "version": "1.0.0",
    "settings": [],
    "fields": [
        {
            "label": "Condition",
            "name": "condition",
            "value": "True",
            "type": "text",
            "required": true
        },
        {
            "label": "Then",
            "name": "then",
            "type": "node"
        },
        {
            "label": "Else",
            "name": "else",
            "type": "node"
        }
    ]
}
