{
  "name": "Gradient",
  "description": "Set a gradient background",
  "category": "image",
  "version": "1.0.0",
  "fields": [
    {
      "name": "startColor",
      "type": "color",
      "value": "#800080",
      "required": true,
      "label": "Start color (hex)"
    },
    {
        "name": "endColor",
        "type": "color",
        "value": "#ffc0cb",
        "required": true,
        "label": "End color (hex)"
    },
    {
        "name": "angle",
        "type": "float",
        "value": "45",
        "required": true,
        "label": "Angle (degrees)"
    }
  ]
}
