{
  "name": "Opacity",
  "description": "Change how transparent an image is",
  "category": "render",
  "version": "1.0.0",
  "fields": [
    { 
      "name": "image", 
      "type": "image", 
      "required": false, 
      "label": "Image (optional)",
      "showIf": [
        {
          "field": ".meta.showOutput"
        }
      ]
    },
    {
      "name": "opacity",
      "type": "float",
      "value": "1",
      "required": true,
      "label": "Opacity (0-1)"
    }
  ],
  "output": [
    {
      "name": "image",
      "type": "image",
      "capabilities": { "forwardsTarget": { "input": "image" } }
    }
  ]
}
