{
    "name": "Grid",
    "description": "Render a grid",
    "category": "render",
    "version": "1.0.0",
    "settings": [],
    "fields": [
        {
            "label": "Rows",
            "name": "rows",
            "value": "1",
            "type": "integer",
            "required": true
        },
        {
            "label": "Columns",
            "name": "columns",
            "value": "1",
            "type": "integer",
            "required": true
        },
        {
            "label": "Render cell: {row} x {column}",
            "name": "render_functions",
            "type": "node",
            "seq": [["row", 1, "rows"], ["column", 1, "columns"]]
        },
        {
            "label": "Render all other cells",
            "name": "render_function",
            "type": "node"
        },
        {
            "label": "Gap",
            "name": "gap",
            "placeholder": "0",
            "type": "string"
        },
        {
            "label": "Margin",
            "name": "margin",
            "placeholder": "0",
            "type": "string"
        },
        {
            "label": "Widths",
            "name": "width_ratios",
            "placeholder": "1 2 1",
            "type": "string"
        },
        {
            "label": "Heights",
            "name": "height_ratios",
            "placeholder": "1 2 1",
            "type": "string"
        }
    ]
}
