{
  "name": "Screenshot URL",
  "description": "Capture a snapshot of a website. The first time you run this it'll install Fireforx or Chromium and another gigabyte of stuff. This only runs on 64-bit Raspberry Pis!",
  "category": "image",
  "version": "1.0.0",
  "fields": [
    {
      "name": "url",
      "type": "text",
      "value": "https://frameos.net/",
      "required": true,
      "label": "URL to capture",
      "placeholder": ""
    },
    {
      "name": "browser",
      "type": "select",
      "options": ["chromium"],
      "value": "chromium",
      "required": true,
      "label": "Browser"
    },
    {
      "name": "scaling_factor",
      "type": "string",
      "value": "1",
      "required": true,
      "label": "Scaling factor"
    }
  ]
}
