{
  "name": "OpenAI Text",
  "description": "Text response from ChatGPT and friends",
  "category": "data",
  "version": "1.0.0",
  "settings": ["openAI"],
  "fields": [
    {
      "name": "system",
      "type": "text",
      "rows": 6,
      "value": "You're a smart e-ink frame running FrameOS. Reply with plain text only. Space is very limited.",
      "required": true,
      "label": "System Prompt"
    },
    {
      "name": "user",
      "type": "text",
      "rows": 6,
      "value": "",
      "required": true,
      "label": "User Prompt",
      "placeholder": "Write your prompt here. Keep it short and clear."
    },
    { "name": "model", "type": "string", "value": "gpt-5.5", "required": true, "label": "Model" }
  ],
  "output": [{ "name": "reply", "type": "string" }],
  "cache": { "enabled": true, "inputEnabled": true, "durationEnabled": true, "duration": "600" }
}
