{
  "name": "Render Image",
  "description": "Render an image onto a canvas",
  "category": "render",
  "version": "1.0.0",
  "fields": [
    {
      "name": "inputImage",
      "type": "image",
      "value": "",
      "required": false,
      "label": "Image to render on (optional)",
      "showIf": [
        {
          "field": ".meta.showOutput"
        }
      ]
    },
    {
      "name": "image",
      "type": "image",
      "required": true,
      "label": "Image",
      "capabilities": {
        "providesTarget": {
          "fitFrom": "placement",
          "fits": [
            "cover", "contain", "stretch", "center",
            "top-left", "top-center", "top-right", "center-left", "center-right",
            "bottom-left", "bottom-center", "bottom-right"
          ],
          "requireStatic": {
            "offsetX": ["0"],
            "offsetY": ["0"],
            "blendMode": ["normal", "overwrite"]
          },
          "compositingRequireStatic": {
            "blendMode": ["normal"]
          },
          "requireUnset": ["inputImage"],
          "ownedTargetExcludes": [
            { "placement": "contain", "blendMode": "overwrite" },
            { "placement": "center", "blendMode": "overwrite" },
            { "placement": "top-left", "blendMode": "overwrite" },
            { "placement": "top-center", "blendMode": "overwrite" },
            { "placement": "top-right", "blendMode": "overwrite" },
            { "placement": "center-left", "blendMode": "overwrite" },
            { "placement": "center-right", "blendMode": "overwrite" },
            { "placement": "bottom-left", "blendMode": "overwrite" },
            { "placement": "bottom-center", "blendMode": "overwrite" },
            { "placement": "bottom-right", "blendMode": "overwrite" }
          ]
        }
      }
    },
    {
      "name": "placement",
      "type": "select",
      "options": [
        "cover",
        "contain",
        "stretch",
        "center",
        "tiled",
        "top-left",
        "top-center",
        "top-right",
        "center-left",
        "center-right",
        "bottom-left",
        "bottom-center",
        "bottom-right"
      ],
      "value": "cover",
      "required": true,
      "label": "Placement"
    },
    {
      "name": "offsetX",
      "type": "integer",
      "value": "0",
      "required": false,
      "label": "Offset X",
      "showIf": [{ "field": "placement", "operator": "notIn", "value": ["cover", "contain", "stretch"] }]
    },
    {
      "name": "offsetY",
      "type": "integer",
      "value": "0",
      "required": false,
      "label": "Offset Y",
      "showIf": [{ "field": "placement", "operator": "notIn", "value": ["cover", "contain", "stretch"] }]
    },
    {
      "name": "blendMode",
      "type": "select",
      "options": [
        "normal",
        "overwrite",
        "darken",
        "multiply",
        "color-burn",
        "lighten",
        "screen",
        "color-dodge",
        "overlay",
        "soft-light",
        "hard-light",
        "difference",
        "exclusion",
        "hue",
        "saturation",
        "color",
        "luminosity",
        "mask",
        "inverse-mask",
        "exclude-mask"
      ],
      "value": "normal",
      "required": false,
      "label": "Blend Mode"
    }
  ],
  "output": [
    {
      "name": "image",
      "type": "image"
    }
  ]
}
