{
  "name": "Render SVG",
  "description": "Render an SVG onto a canvas",
  "category": "render",
  "version": "1.0.0",
  "fields": [
    {
      "name": "inputImage",
      "type": "image",
      "value": "",
      "required": false,
      "label": "Image to render on (optional)",
      "showIf": [
        {
          "field": ".meta.showOutput"
        }
      ]
    },
    {
      "name": "svg",
      "type": "text",
      "value": "",
      "required": true,
      "label": "SVG",
      "hint": "Provide raw SVG markup or a data URL like data:image/svg+xml;charset=utf-8,<svg...>. <text> is supported: one line per text/tspan (no wrapping), font-family matches the fonts in your assets folder, and unknown fonts fall back to the default."
    },
    {
      "name": "placement",
      "type": "select",
      "options": [
        "cover",
        "contain",
        "stretch",
        "center",
        "tiled",
        "top-left",
        "top-center",
        "top-right",
        "center-left",
        "center-right",
        "bottom-left",
        "bottom-center",
        "bottom-right"
      ],
      "value": "cover",
      "required": true,
      "label": "Placement"
    },
    {
      "name": "offsetX",
      "type": "integer",
      "value": "0",
      "required": false,
      "label": "Offset X",
      "showIf": [{ "field": "placement", "operator": "notIn", "value": ["cover", "contain", "stretch"] }]
    },
    {
      "name": "offsetY",
      "type": "integer",
      "value": "0",
      "required": false,
      "label": "Offset Y",
      "showIf": [{ "field": "placement", "operator": "notIn", "value": ["cover", "contain", "stretch"] }]
    },
    {
      "name": "blendMode",
      "type": "select",
      "options": [
        "normal",
        "overwrite",
        "darken",
        "multiply",
        "color-burn",
        "lighten",
        "screen",
        "color-dodge",
        "overlay",
        "soft-light",
        "hard-light",
        "difference",
        "exclusion",
        "hue",
        "saturation",
        "color",
        "luminosity",
        "mask",
        "inverse-mask",
        "exclude-mask"
      ],
      "value": "normal",
      "required": false,
      "label": "Blend Mode"
    }
  ],
  "output": [
    {
      "name": "image",
      "type": "image"
    }
  ]
}
